{
  "schema_version": "0.1.0",
  "run_id": "illustrative-only-no-run-executed",
  "model_id": "not-trained",
  "decision": "needs_review",
  "scale": {"status": "unknown", "source": "No measured example assets", "output_unit": "m", "relative_uncertainty": null},
  "tolerance_m": 0.0001,
  "deviation_reference": "unavailable",
  "metrics": {"observed_coverage": null, "symmetric_chamfer_l1_m": null, "hausdorff95_m": null, "dimension_relative_error": null},
  "checks": {
    "brep_valid": {"status": "not_run", "evidence": "No generated CAD exists."},
    "watertight": {"status": "not_run", "evidence": "No generated surface exists."},
    "manifold": {"status": "not_run", "evidence": "No generated surface exists."},
    "self_intersections": {"status": "not_run", "evidence": "No generated surface exists."},
    "positive_volume": {"status": "not_run", "evidence": "No generated solid exists."},
    "dimension_policy": {"status": "unknown", "evidence": "No measured dimensions or case tolerance policy exist."},
    "observed_coverage_policy": {"status": "unknown", "evidence": "No observations or coverage policy exist."}
  },
  "human_review": "pending",
  "limitations": ["Illustrative schema example only; no reconstruction was performed.", "Unknown metrics cannot satisfy acceptance gates."],
  "outputs": []
}
